commit	val_bpb	memory_gb	status	description
fcf7bc29eec3ebbafcd81cc533f5a7d05cdcd4ad	0.552145	2.3	discard	Exp 248: DEPTH=6 AR=56 model_dim=384 (worse, 320-dim optimal)
c779176cf97ad294e8778cd360758bf13db9c4b0	0.557468	2.3	discard	Exp 249: T=410s (worse, noise, 420s confirmed optimal)
bd7f2f2672b81702c185f3670b21d54c3ae37097	0.560138	2.3	discard	Exp 250: MATRIX_LR=0.036 on DEPTH=6 (worse, 0.04 optimal)
d6454cef55526e5b6af6f6c3c884a38fa5186073	0.554145	2.3	discard	Exp 251: EMBEDDING_LR=1.0 on DEPTH=6 (worse, 1.2 optimal)
386dc45a01201355ba3feb5c140b290eb372c846	0.555320	2.3	discard	Exp 252: UNEMBEDDING_LR=0.002 on DEPTH=6 (worse, 0.003 optimal)
12d9e7cd92a54ac8d67d85cb1464a0a1edfd9fe4	0.564044	2.3	discard	Exp 253: WARMDOWN_RATIO=0.4 on DEPTH=6 (worse, 0.5 optimal)
0a6b288f2eb55259d73f050ff23bba74e189e2bd	0.553314	2.3	discard	Exp 254: ve_gate_channels=32 on DEPTH=6 (worse, 28 still optimal)
7e46db750c796860f5804405373d2c04b0fc8702	0.567822	2.3	discard	Exp 255: WINDOW_PATTERN=LS on DEPTH=6 (worse, L optimal)
bfa82770ece43d9e43f52022258a33988be188a6	0.565852	2.3	discard	Exp 256: DEPTH=7 AR=45 T=470s (worse, DEPTH=6 is optimal depth)
c626a9546b33fdc8a39f161a17b3a030d4326538	0.554850	2.3	discard	Exp 257: WEIGHT_DECAY=0.25 on DEPTH=6 (worse, 0.2 optimal)
f6fedd65effcb40f901b13d7fe6f40034972e62d	0.560581	2.3	discard	Exp 258: ADAM_BETAS=(0.85,0.95) on DEPTH=6 (worse, (0.8,0.95) optimal)
8d9a746f26adf3714e94318075a5bdecd1485f8a	0.570784	2.3	discard	Exp 259: VE at all layers on DEPTH=6 (worse, alternating optimal)
b12accd91ef2e4dfd58918461f839d5befc7b133	0.571530	2.3	discard	Exp 260: TOTAL_BATCH_SIZE=2^13 on DEPTH=6 (worse, 2^14 optimal)
7ea5531b3a8f215ecda8ba282fdcd13cacefde87	0.553467	2.3	discard	Exp 261: Muon beta2=0.98 on DEPTH=6 (worse, 0.95 optimal)
fc7913f3faf8358ade3112f52e6593ac2c9e51e3	0.553607	2.3	discard	Exp 262: VE at even layers 0,2,4 on DEPTH=6 (worse, odd layers optimal)
8b686f020e6ad5e52bcb4e6d7610fb66191ba166	0.559468	2.3	discard	Exp 263: DEPTH=6 AR=40 model_dim=256 (worse, 320-dim optimal)
32c28a59a68ee94df5e899f7c772885916e30a62	0.559849	2.3	discard	Exp 264: x0_lambdas init=0.0 on DEPTH=6 (worse, 0.1 optimal)
5988f1cf01fc4e7f0c90bcecf48c65ef9cf093af	0.569096	2.3	discard	Exp 265: UNEMBEDDING_LR=0.004 on DEPTH=6 (worse, 0.003 confirmed optimal)
ac8dcf49a52927f2b04f930ec8145b4b27d27741	0.565850	2.3	discard	Exp 266: EMBEDDING_LR=1.5 on DEPTH=6 (worse, 1.2 optimal)
6f644d7b393bb1cc218d4e0a93fd30898a69b5da	0.561008	2.3	discard	Exp 267: Muon momentum warmup 500 steps (worse, 300 optimal)
062501b039363eab8fe93ee4fee8511985673818	0.555396	2.3	discard	Exp 268: x0_lambdas init=0.2 (worse, 0.1 optimal)
062501b039363eab8fe93ee4fee8511985673818	0.563617	2.3	discard	Exp 269: FINAL_LR_FRAC=0.05 (worse, 0.0 optimal)
062501b039363eab8fe93ee4fee8511985673818	0.581469	2.3	discard	Exp 270: resid_lambdas init=0.9 (much worse, 1.0 optimal)
062501b039363eab8fe93ee4fee8511985673818	0.563740	2.3	discard	Exp 271: Muon final momentum=0.97 (worse, 0.95 optimal)
062501b039363eab8fe93ee4fee8511985673818	0.552038	2.3	discard	Exp 272: ns_steps=6 (slightly worse, 5 optimal)
062501b039363eab8fe93ee4fee8511985673818	0.559505	2.3	discard	Exp 273: SCALAR_LR=0.4 (worse, 0.5 optimal)
062501b039363eab8fe93ee4fee8511985673818	0.574497	2.3	discard	Exp 274: MLP_RATIO=4 (worse, 3 optimal)
062501b039363eab8fe93ee4fee8511985673818	0.561424	2.3	discard	Exp 275: ve_gate_channels=32 (worse, 28 optimal)
062501b039363eab8fe93ee4fee8511985673818	0.556807	2.3	discard	Exp 276: TIME_BUDGET=430s (worse, 420s optimal)
062501b039363eab8fe93ee4fee8511985673818	0.562612	2.3	discard	Exp 277: WEIGHT_DECAY=0.15 (worse, 0.2 optimal)
062501b039363eab8fe93ee4fee8511985673818	0.566305	2.3	discard	Exp 278: softcap=30 (worse, 15 optimal)
062501b039363eab8fe93ee4fee8511985673818	0.559255	2.3	discard	Exp 279: softcap=10 (worse, 15 optimal)
062501b039363eab8fe93ee4fee8511985673818	0.571308	2.3	discard	Exp 280: ROPE_BASE=5000 (worse, 10000 optimal)
062501b039363eab8fe93ee4fee8511985673818	0.555531	2.3	discard	Exp 281: ROPE_BASE=50000 (worse, 10000 optimal)
062501b039363eab8fe93ee4fee8511985673818	0.553657	2.3	discard	Exp 282: WARMDOWN_RATIO=0.4 (worse but closer, 0.5 optimal)
062501b039363eab8fe93ee4fee8511985673818	0.553734	2.3	discard	Exp 283: WARMDOWN_RATIO=0.6 (worse, 0.5 optimal)
062501b039363eab8fe93ee4fee8511985673818	0.560094	2.3	discard	Exp 284: ADAM_BETAS=(0.85,0.95) (worse, (0.8,0.95) optimal)
062501b039363eab8fe93ee4fee8511985673818	0.560679	2.3	discard	Exp 285: ve_gate scale=3 (worse, scale=2 optimal)
062501b039363eab8fe93ee4fee8511985673818	0.557398	2.3	discard	Exp 286: ve_gate scale=1.5 (worse, scale=2 optimal)
062501b039363eab8fe93ee4fee8511985673818	0.556193	2.3	discard	Exp 287: Muon init momentum=0.90 (worse, 0.85 optimal)
062501b039363eab8fe93ee4fee8511985673818	0.563288	2.3	discard	Exp 288: MATRIX_LR=0.042 (worse, 0.04 optimal)
062501b039363eab8fe93ee4fee8511985673818	0.563915	2.3	discard	Exp 289: constant WD no annealing (worse, annealed optimal)
062501b039363eab8fe93ee4fee8511985673818	0.562684	2.3	discard	Exp 290: cosine LR warmdown (worse, linear optimal)
c8a281c	0.549389	2.3	keep	Exp 291: TOTAL_BATCH_SIZE=2^15 (NEW BEST 0.549389)
c8a281c4225ef836874bf52544260df9e45d7670	0.563244	2.3	discard	Exp 292: TOTAL_BATCH_SIZE=2^16 (worse, 2^15 optimal)
c8a281c4225ef836874bf52544260df9e45d7670	0.562613	2.3	discard	Exp 293: 2^15 + MATRIX_LR=0.057 sqrt2 scaled (worse)
c8a281c4225ef836874bf52544260df9e45d7670	0.558794	2.3	discard	Exp 294: 2^15 + EMBEDDING_LR=1.7 (worse, 1.2 optimal)
74518ee	0.548060	2.3	keep	Exp 295: TOTAL_BATCH_SIZE=2^15 T=450s (NEW BEST 0.548060)
658cc29	0.543643	2.3	keep	Exp 296: TOTAL_BATCH_SIZE=2^15 T=480s (NEW BEST 0.543643)
658cc293faa8b5af24f9bae441ea1fca4c08d973	0.544357	2.3	discard	Exp 297: 2^15 T=510s (slightly worse than 480s)
658cc293faa8b5af24f9bae441ea1fca4c08d973	0.549383	2.3	discard	Exp 298: 2^15 T=500s (worse, 480s optimal)
658cc293faa8b5af24f9bae441ea1fca4c08d973	0.547982	2.3	discard	Exp 299: 2^15 T=490s (worse, 480s optimal)
e9b13be	0.543465	2.3	keep	Exp 300: 2^15 T=480s ns_steps=6 (NEW BEST 0.543465)
e9b13bed46f93f839c6f3d7dbd539923013c04cf	0.546640	2.3	discard	Exp 301: ns_steps=7 (worse, 6 optimal)
db329fb	0.543240	2.3	keep	Exp 302: 2^15 T=480s ns=6 MATRIX_LR=0.035 (NEW BEST 0.543240)
db329fbfe336f449c89f30433c312f9b1a7361b4	0.546760	2.3	discard	Exp 303: MATRIX_LR=0.030 (worse, 0.035 optimal)
db329fbfe336f449c89f30433c312f9b1a7361b4	0.548112	2.3	discard	Exp 304: EMBEDDING_LR=1.0 (worse, 1.2 optimal)
db329fbfe336f449c89f30433c312f9b1a7361b4	0.547228	2.3	discard	Exp 305: SCALAR_LR=0.6 (worse, 0.5 optimal)
db329fbfe336f449c89f30433c312f9b1a7361b4	0.543362	2.3	discard	Exp 306: UNEMBEDDING_LR=0.002 (slightly worse, 0.003 optimal)
db329fbfe336f449c89f30433c312f9b1a7361b4	0.543301	2.3	discard	Exp 307: Muon beta2=0.97 (essentially same as 0.95)
db329fbfe336f449c89f30433c312f9b1a7361b4	0.543591	2.3	discard	Exp 308: WEIGHT_DECAY=0.25 (slightly worse, 0.2 optimal)
7f2f4a9	0.541114	2.3	keep	Exp 309: ADAM_BETAS=(0.8,0.98) (NEW BEST 0.541114)
0d4d0f9	0.540507	2.3	keep	Exp 310: ADAM_BETAS=(0.8,0.99) (NEW BEST 0.540507)
0d4d0f9f8e2eb8613e411deaefa9896753850728	0.541235	2.3	discard	Exp 311: ADAM_BETAS=(0.8,0.999) (worse, 0.99 optimal)
84e934b	0.539595	2.3	keep	Exp 312: x0_params betas=(0.96,0.99) (NEW BEST 0.539595)
84e934be51eb9245b31224fdd783b1c4e77ea629	0.541891	2.3	discard	Exp 313: x0_params betas=(0.96,0.999) (worse, 0.99 optimal)
84e934be51eb9245b31224fdd783b1c4e77ea629	0.541886	2.3	discard	Exp 314: resid_params betas=(0.96,0.99) (worse, adam_betas better)
84e934be51eb9245b31224fdd783b1c4e77ea629	0.541384	2.3	discard	Exp 315: EMBEDDING_LR=1.1 (worse, 1.2 optimal)
84e934be51eb9245b31224fdd783b1c4e77ea629	0.547169	2.3	discard	Exp 316: EMBEDDING_LR=1.3 (worse, 1.2 optimal)
84e934be51eb9245b31224fdd783b1c4e77ea629	0.555621	2.3	discard	Exp 317: Muon beta2=0.97 (much worse, 0.95 optimal)
84e934be51eb9245b31224fdd783b1c4e77ea629	0.560090	2.3	discard	Exp 318: DEPTH=6 AR=64 model_dim=384 (worse, AR=48 optimal)
84e934be51eb9245b31224fdd783b1c4e77ea629	0.555974	2.3	discard	Exp 319: MATRIX_LR=0.033 (worse, 0.035 optimal)
84e934be51eb9245b31224fdd783b1c4e77ea629	0.554311	2.3	discard	Exp 320: WARMUP_RATIO=0.01 (worse, 0.0 optimal)
84e934be51eb9245b31224fdd783b1c4e77ea629	0.553174	2.3	discard	Exp 321: x0_params beta1=0.9 (worse, 0.96 optimal)
84e934be51eb9245b31224fdd783b1c4e77ea629	0.557330	2.3	discard	Exp 322: x0_params beta1=0.98 (worse, 0.96 optimal)
84e934be51eb9245b31224fdd783b1c4e77ea629	0.555112	2.3	discard	Exp 323: DEPTH=5 480s (worse, DEPTH=6 optimal)
84e934be51eb9245b31224fdd783b1c4e77ea629	0.552110	2.3	discard	Exp 324: LM head init std=0.01 (worse, 0.001 optimal)
84e934be51eb9245b31224fdd783b1c4e77ea629	0.544979	2.3	discard	Exp 325: DEPTH=7 2^15 T=600s (worse, DEPTH=6 optimal)
84e934be51eb9245b31224fdd783b1c4e77ea629	0.549849	2.3	discard	Exp 326: Muon init mom=0.80 (worse, 0.85 optimal)
84e934be51eb9245b31224fdd783b1c4e77ea629	0.546987	2.3	discard	Exp 327: softcap=20 (worse, 15 optimal)
84e934be51eb9245b31224fdd783b1c4e77ea629	0.561214	2.3	discard	Exp 328: ADAM_BETAS=(0.85,0.99) (worse, (0.8,0.99) optimal)
84e934be51eb9245b31224fdd783b1c4e77ea629	0.552750	2.3	discard	Exp 329: ADAM_BETAS=(0.75,0.99) (worse, 0.8 optimal)
84e934be51eb9245b31224fdd783b1c4e77ea629	0.544346	2.3	discard	Exp 330: eps=1e-8 (worse, 1e-10 optimal)
84e934be51eb9245b31224fdd783b1c4e77ea629	0.556199	2.3	discard	Exp 331: x0_params lr=0.3 (worse, lr=scalar_lr=0.5 optimal)
84e934be51eb9245b31224fdd783b1c4e77ea629	0.558311	2.3	discard	Exp 332: SCALAR_LR=0.6 (worse, 0.5 optimal)
84e934be51eb9245b31224fdd783b1c4e77ea629	0.552850	2.3	discard	Exp 333: Muon beta2=0.98 (worse, 0.95 optimal)
84e934be51eb9245b31224fdd783b1c4e77ea629	0.557204	2.3	discard	Exp 334: WARMDOWN_RATIO=0.45 (worse, 0.5 optimal)
84e934be51eb9245b31224fdd783b1c4e77ea629	0.572691	2.3	discard	Exp 335: WEIGHT_DECAY=0.15 (worse, 0.2 optimal)
84e934be51eb9245b31224fdd783b1c4e77ea629	0.579121	2.3	discard	Exp 336: ve_gate_channels=64 (worse, 28 optimal)
84e934be51eb9245b31224fdd783b1c4e77ea629	0.556546	2.3	discard	Exp 337: EMBEDDING_LR=1.0 (worse, 1.2 optimal)
84e934be51eb9245b31224fdd783b1c4e77ea629	0.566709	2.3	discard	Exp 338: EMBEDDING_LR=1.4 (worse, 1.2 optimal)
84e934be51eb9245b31224fdd783b1c4e77ea629	0.570994	2.3	discard	Exp 339: Muon warmup=400 steps (worse, 300 optimal)
84e934be51eb9245b31224fdd783b1c4e77ea629	0.562649	2.3	discard	Exp 340: UNEMBEDDING_LR=0.004 (worse, 0.003 optimal)
84e934be51eb9245b31224fdd783b1c4e77ea629	0.564741	2.3	discard	Exp 341: DEPTH=7 AR=42 (worse, DEPTH=6 AR=48 optimal)
84e934be51eb9245b31224fdd783b1c4e77ea629	0.558043	2.3	discard	Exp 342: DEPTH=5 AR=60 (worse, DEPTH=6 AR=48 optimal)
84e934be51eb9245b31224fdd783b1c4e77ea629	0.559873	2.3	discard	Exp 343: no VE ablation (worse, VE at odd layers optimal)
84e934be51eb9245b31224fdd783b1c4e77ea629	0.567112	2.3	discard	Exp 344: VE all layers (worse, odd layers optimal)
84e934be51eb9245b31224fdd783b1c4e77ea629	0.557008	2.3	discard	Exp 345: 2^16 batch 640s (worse, 2^15 480s optimal)
84e934be51eb9245b31224fdd783b1c4e77ea629	0.556970	2.3	discard	Exp 346: FINAL_LR_FRAC=0.05 (worse, 0.0 optimal)
84e934be51eb9245b31224fdd783b1c4e77ea629	0.557808	2.3	discard	Exp 347: Muon target mom=0.93 (worse, 0.95 optimal)
84e934be51eb9245b31224fdd783b1c4e77ea629	0.575383	2.3	discard	Exp 348: Muon target mom=0.97 (worse, 0.95 optimal)
84e934be51eb9245b31224fdd783b1c4e77ea629	0.570325	2.3	discard	Exp 349: MLP_RATIO=4 (worse, 3 optimal)
84e934be51eb9245b31224fdd783b1c4e77ea629	0.558709	2.3	discard	Exp 350: MLP_RATIO=2 (worse, 3 optimal)
84e934be51eb9245b31224fdd783b1c4e77ea629	0.554659	2.3	discard	Exp 351: MATRIX_LR=0.036 (worse, 0.035 optimal)
84e934be51eb9245b31224fdd783b1c4e77ea629	0.559893	2.3	discard	Exp 352: ROPE_BASE=1000 (worse, 10000 optimal)
84e934be51eb9245b31224fdd783b1c4e77ea629	0.557419	2.3	discard	Exp 353: softcap=10 (worse, 15 optimal)
84e934be51eb9245b31224fdd783b1c4e77ea629	0.562932	2.3	discard	Exp 354: WARMDOWN_RATIO=0.55 (worse, 0.5 optimal)
84e934be51eb9245b31224fdd783b1c4e77ea629	0.565864	2.3	discard	Exp 355: WEIGHT_DECAY=0.25 (worse, 0.2 optimal)
84e934be51eb9245b31224fdd783b1c4e77ea629	0.560559	2.3	discard	Exp 356: DEPTH=6 AR=54 model_dim=384 (worse, AR=48 dim=320 optimal)
84e934be51eb9245b31224fdd783b1c4e77ea629	0.569738	2.3	discard	Exp 357: WARMUP_RATIO=0.05 (worse, 0.0 optimal)
84e934be51eb9245b31224fdd783b1c4e77ea629	0.569813	2.3	discard	Exp 358: WINDOW_PATTERN=SL (worse, L optimal)
84e934be51eb9245b31224fdd783b1c4e77ea629	0.589784	2.3	discard	Exp 359: DEPTH=4 AR=80 (worse, DEPTH=6 AR=48 optimal)
84e934be51eb9245b31224fdd783b1c4e77ea629	0.562186	2.3	discard	Exp 360: resid_params betas=(0.96,0.99) (worse, (0.8,0.99) optimal)
84e934be51eb9245b31224fdd783b1c4e77ea629	0.557356	2.3	discard	Exp 361: ve_gate_channels=16 (worse, 28 optimal)
84e934be51eb9245b31224fdd783b1c4e77ea629	0.563712	2.3	discard	Exp 362: VE gate scale=1 (worse, scale=2 optimal)
84e934be51eb9245b31224fdd783b1c4e77ea629	0.558421	2.3	discard	Exp 363: VE gate scale=3 (worse, scale=2 optimal)
84e934be51eb9245b31224fdd783b1c4e77ea629	0.552422	2.3	discard	Exp 364: AR=54 dim=384 600s (worse, AR=48 dim=320 480s optimal)
84e934be51eb9245b31224fdd783b1c4e77ea629	0.549097	2.3	discard	Exp 365: DEPTH=8 AR=36 640s (worse, DEPTH=6 AR=48 480s optimal)
84e934be51eb9245b31224fdd783b1c4e77ea629	0.554399	2.3	discard	Exp 366: constant WD (worse, decaying WD optimal)
84e934be51eb9245b31224fdd783b1c4e77ea629	0.547402	2.3	discard	Exp 367: ADAM_BETAS=(0.78,0.99) (worse, (0.8,0.99) optimal)
84e934be51eb9245b31224fdd783b1c4e77ea629	0.567327	2.3	discard	Exp 368: ROPE_BASE=100 (worse, 10000 optimal so far)
84e934be51eb9245b31224fdd783b1c4e77ea629	0.557049	2.3	discard	Exp 369: ROPE_BASE=100000 (worse, 10000 optimal)
84e934be51eb9245b31224fdd783b1c4e77ea629	0.565906	2.3	discard	Exp 370: HEAD_DIM=32 10heads (worse, HEAD_DIM=64 5heads optimal)
84e934be51eb9245b31224fdd783b1c4e77ea629	0.556886	2.3	discard	Exp 371: SwiGLU MLP (worse, SiLU optimal)
84e934be51eb9245b31224fdd783b1c4e77ea629	0.560545	2.3	discard	Exp 372: parallel block (worse, sequential optimal)
84e934be51eb9245b31224fdd783b1c4e77ea629	0.559733	2.3	discard	Exp 373: no QK-Norm (worse, QK-Norm optimal)
84e934be51eb9245b31224fdd783b1c4e77ea629	0.555285	2.3	discard	Exp 374: QK-Norm before RoPE (worse, after-RoPE optimal)
84e934be51eb9245b31224fdd783b1c4e77ea629	0.577983	2.3	discard	Exp 375: SDPA scale=1.0 (much worse, default scale optimal)
84e934be51eb9245b31224fdd783b1c4e77ea629	0.554248	2.3	discard	Exp 376: GELU activation (worse, SiLU optimal)
84e934be51eb9245b31224fdd783b1c4e77ea629	0.539555	2.3	keep	Exp 425: wte init std=0.5 NEW BEST (was 1.0, smaller init helps)
